<?xml version="1.0" encoding="UTF-8" ?>
    <User xmlns:xsi="http://www.w3.org/2001/XMLSchema-instance" xsi:noNamespaceSchemaLocation="musicdata.xsd">
        <userId>1</userId>
        <name>john123</name>
        <email>john@example.com</email>
        <password>password</password>
        <userProfile>
            <id>1</id>
            <bio>John bio</bio>
            <profileimage>profile.jpg</profileimage>
            <location>London</location>
        </userProfile>
        <playlistList>
            <playlist>
                <playlistid>1</playlistid>
                <playlistName>My Playlist</playlistName>
            </playlist>
            <playlist>
                <playlistid>2</playlistid>
                <playlistName>Japan vs Korean</playlistName>
            </playlist>
        </playlistList>
        <wishlistList>
            <wishlist>
                <wishlistid>1</wishlistid>
                <name>john123wish</name>
                <albumList>
                    <album>
                        <albumid>1</albumid>
                        <albumName>1989</albumName>
                        <albumDate>2022-01-01</albumDate>
                    </album>
                    <album>
                        <albumid>2</albumid>
                        <albumName>The Book</albumName>
                        <albumDate>2021-03-01</albumDate>
                    </album>
                </albumList>
            </wishlist>
            <wishlist>
                <wishlistid>2</wishlistid>
                <name>johnjpopwish</name>
                <albumList>
                    <album>
                        <albumid>3</albumid>
                        <albumName>META</albumName>
                        <albumDate>2021-05-17</albumDate>
                    </album>
                    <album>
                        <albumid>4</albumid>
                        <albumName>Bokurano</albumName>
                        <albumDate>2021-03-22</albumDate>
                    </album>
                </albumList>
            </wishlist>
        </wishlistList>
    </User>
